{
  "created_at_utc": "2026-07-22T13:07:28Z",
  "database_volume": "complaint-triage-ml_postgres_data",
  "lineage": {
    "api_contract_commit_sha": "f10324b3e42c146fc6de1caacfb0bb63691e6b4a",
    "code_commit_sha": "46b7402d1b4537842d2f96ae1adbd7740a4e6560",
    "working_tree_clean": true
  },
  "partition": {
    "export_record_limit": 100000,
    "shard_byte_limit": 1073741824,
    "shard_count": 16,
    "window_end_exclusive": "2025-01-01",
    "window_start_inclusive": "2023-09-01"
  },
  "policy": {
    "expires_at_utc": "2026-11-19T15:59:59Z",
    "retention_policy_id": "cfpb-local-120d-v1"
  },
  "privacy": {
    "contains_row_values": false,
    "git_tracking_allowed": true
  },
  "run_id": "cfpb-run-20260722T130728Z-2b7815d4c850",
  "run_manifest_version": "1.0.0",
  "shards": [
    {
      "api_date_received_max": "2023-09-30",
      "api_date_received_min": "2023-09-01",
      "artifact_byte_count": 73562482,
      "artifact_relative_path": "data/raw/cfpb/sha256/cf/cf11ef0c23cbf0aa6a298f57e7421ab8025fa96152d3a7010755e44480112426.json",
      "artifact_sha256": "cf11ef0c23cbf0aa6a298f57e7421ab8025fa96152d3a7010755e44480112426",
      "batch_id": "cfpb-20260722T130728Z-cf11ef0c23cb",
      "end_exclusive": "2023-10-01",
      "manifest_relative_path": "data/manifests/cfpb/cfpb-20260722T130728Z-cf11ef0c23cb.json",
      "month": "2023-09",
      "ordinal": 0,
      "preflight_count": 42517,
      "returned_record_count": 42517,
      "start_inclusive": "2023-09-01"
    },
    {
      "api_date_received_max": "2023-10-31",
      "api_date_received_min": "2023-10-01",
      "artifact_byte_count": 74045937,
      "artifact_relative_path": "data/raw/cfpb/sha256/45/452e2b86d9a4534a911050904ce09e937b222f092a672ee7642b63686debcdf5.json",
      "artifact_sha256": "452e2b86d9a4534a911050904ce09e937b222f092a672ee7642b63686debcdf5",
      "batch_id": "cfpb-20260722T130803Z-452e2b86d9a4",
      "end_exclusive": "2023-11-01",
      "manifest_relative_path": "data/manifests/cfpb/cfpb-20260722T130803Z-452e2b86d9a4.json",
      "month": "2023-10",
      "ordinal": 1,
      "preflight_count": 43349,
      "returned_record_count": 43349,
      "start_inclusive": "2023-10-01"
    },
    {
      "api_date_received_max": "2023-11-30",
      "api_date_received_min": "2023-11-01",
      "artifact_byte_count": 65906694,
      "artifact_relative_path": "data/raw/cfpb/sha256/79/793f6bc977c8d7b6c73b82e4d34a29d99bcd49dd3ce770fcc570ab135032f752.json",
      "artifact_sha256": "793f6bc977c8d7b6c73b82e4d34a29d99bcd49dd3ce770fcc570ab135032f752",
      "batch_id": "cfpb-20260722T130838Z-793f6bc977c8",
      "end_exclusive": "2023-12-01",
      "manifest_relative_path": "data/manifests/cfpb/cfpb-20260722T130838Z-793f6bc977c8.json",
      "month": "2023-11",
      "ordinal": 2,
      "preflight_count": 38894,
      "returned_record_count": 38894,
      "start_inclusive": "2023-11-01"
    },
    {
      "api_date_received_max": "2023-12-31",
      "api_date_received_min": "2023-12-01",
      "artifact_byte_count": 75188938,
      "artifact_relative_path": "data/raw/cfpb/sha256/1d/1dd12470e6eb70eb50bc1db056550584d67c102fd9cef331e57fada16d4039a5.json",
      "artifact_sha256": "1dd12470e6eb70eb50bc1db056550584d67c102fd9cef331e57fada16d4039a5",
      "batch_id": "cfpb-20260722T130913Z-1dd12470e6eb",
      "end_exclusive": "2024-01-01",
      "manifest_relative_path": "data/manifests/cfpb/cfpb-20260722T130913Z-1dd12470e6eb.json",
      "month": "2023-12",
      "ordinal": 3,
      "preflight_count": 40851,
      "returned_record_count": 40851,
      "start_inclusive": "2023-12-01"
    },
    {
      "api_date_received_max": "2024-01-31",
      "api_date_received_min": "2024-01-01",
      "artifact_byte_count": 79347561,
      "artifact_relative_path": "data/raw/cfpb/sha256/97/974cc9dbafaadf5de03f438af63051c774c80a568bcf5812e06f9f32e5216199.json",
      "artifact_sha256": "974cc9dbafaadf5de03f438af63051c774c80a568bcf5812e06f9f32e5216199",
      "batch_id": "cfpb-20260722T130951Z-974cc9dbafaa",
      "end_exclusive": "2024-02-01",
      "manifest_relative_path": "data/manifests/cfpb/cfpb-20260722T130951Z-974cc9dbafaa.json",
      "month": "2024-01",
      "ordinal": 4,
      "preflight_count": 43920,
      "returned_record_count": 43920,
      "start_inclusive": "2024-01-01"
    },
    {
      "api_date_received_max": "2024-02-29",
      "api_date_received_min": "2024-02-01",
      "artifact_byte_count": 85894835,
      "artifact_relative_path": "data/raw/cfpb/sha256/17/1723ac488ad6f0697e55282069be7010856afd591a821f8635cf90fc47c18c17.json",
      "artifact_sha256": "1723ac488ad6f0697e55282069be7010856afd591a821f8635cf90fc47c18c17",
      "batch_id": "cfpb-20260722T131027Z-1723ac488ad6",
      "end_exclusive": "2024-03-01",
      "manifest_relative_path": "data/manifests/cfpb/cfpb-20260722T131027Z-1723ac488ad6.json",
      "month": "2024-02",
      "ordinal": 5,
      "preflight_count": 48111,
      "returned_record_count": 48111,
      "start_inclusive": "2024-02-01"
    },
    {
      "api_date_received_max": "2024-03-31",
      "api_date_received_min": "2024-03-01",
      "artifact_byte_count": 102091310,
      "artifact_relative_path": "data/raw/cfpb/sha256/ac/acce6918d2319f142f3ba8c2ba4cd39d8fde9dfb096fcf916409c4369b53430c.json",
      "artifact_sha256": "acce6918d2319f142f3ba8c2ba4cd39d8fde9dfb096fcf916409c4369b53430c",
      "batch_id": "cfpb-20260722T131100Z-acce6918d231",
      "end_exclusive": "2024-04-01",
      "manifest_relative_path": "data/manifests/cfpb/cfpb-20260722T131100Z-acce6918d231.json",
      "month": "2024-03",
      "ordinal": 6,
      "preflight_count": 61162,
      "returned_record_count": 61162,
      "start_inclusive": "2024-03-01"
    },
    {
      "api_date_received_max": "2024-04-30",
      "api_date_received_min": "2024-04-01",
      "artifact_byte_count": 107301552,
      "artifact_relative_path": "data/raw/cfpb/sha256/d8/d84d690bd2fcca20dc683c0933388ca2ad4e7d036ed07e57e60ea20ff256adb6.json",
      "artifact_sha256": "d84d690bd2fcca20dc683c0933388ca2ad4e7d036ed07e57e60ea20ff256adb6",
      "batch_id": "cfpb-20260722T131136Z-d84d690bd2fc",
      "end_exclusive": "2024-05-01",
      "manifest_relative_path": "data/manifests/cfpb/cfpb-20260722T131136Z-d84d690bd2fc.json",
      "month": "2024-04",
      "ordinal": 7,
      "preflight_count": 63970,
      "returned_record_count": 63970,
      "start_inclusive": "2024-04-01"
    },
    {
      "api_date_received_max": "2024-05-31",
      "api_date_received_min": "2024-05-01",
      "artifact_byte_count": 116769201,
      "artifact_relative_path": "data/raw/cfpb/sha256/a8/a890bb6a230350b531ebf6aaffe2ae96325c0a5b75f0f9869d678e78d908f351.json",
      "artifact_sha256": "a890bb6a230350b531ebf6aaffe2ae96325c0a5b75f0f9869d678e78d908f351",
      "batch_id": "cfpb-20260722T131211Z-a890bb6a2303",
      "end_exclusive": "2024-06-01",
      "manifest_relative_path": "data/manifests/cfpb/cfpb-20260722T131211Z-a890bb6a2303.json",
      "month": "2024-05",
      "ordinal": 8,
      "preflight_count": 71313,
      "returned_record_count": 71313,
      "start_inclusive": "2024-05-01"
    },
    {
      "api_date_received_max": "2024-06-30",
      "api_date_received_min": "2024-06-01",
      "artifact_byte_count": 109543610,
      "artifact_relative_path": "data/raw/cfpb/sha256/a0/a0cdf10fd2ec570733b498b4e4862e740d067f695f8ddfed102f51b689ffc9b3.json",
      "artifact_sha256": "a0cdf10fd2ec570733b498b4e4862e740d067f695f8ddfed102f51b689ffc9b3",
      "batch_id": "cfpb-20260722T131246Z-a0cdf10fd2ec",
      "end_exclusive": "2024-07-01",
      "manifest_relative_path": "data/manifests/cfpb/cfpb-20260722T131246Z-a0cdf10fd2ec.json",
      "month": "2024-06",
      "ordinal": 9,
      "preflight_count": 68200,
      "returned_record_count": 68200,
      "start_inclusive": "2024-06-01"
    },
    {
      "api_date_received_max": "2024-07-31",
      "api_date_received_min": "2024-07-01",
      "artifact_byte_count": 121795757,
      "artifact_relative_path": "data/raw/cfpb/sha256/5a/5a168d9b1d5f165b7f8c31a92c36d3f259dfa81bae2191a1ebd6cbbe1fd2f8e0.json",
      "artifact_sha256": "5a168d9b1d5f165b7f8c31a92c36d3f259dfa81bae2191a1ebd6cbbe1fd2f8e0",
      "batch_id": "cfpb-20260722T131321Z-5a168d9b1d5f",
      "end_exclusive": "2024-08-01",
      "manifest_relative_path": "data/manifests/cfpb/cfpb-20260722T131321Z-5a168d9b1d5f.json",
      "month": "2024-07",
      "ordinal": 10,
      "preflight_count": 72849,
      "returned_record_count": 72849,
      "start_inclusive": "2024-07-01"
    },
    {
      "api_date_received_max": "2024-08-31",
      "api_date_received_min": "2024-08-01",
      "artifact_byte_count": 130739845,
      "artifact_relative_path": "data/raw/cfpb/sha256/53/5385767a00df18169e12d29f565a0125ffcbaa03f5368140fd7ffb2c9496b781.json",
      "artifact_sha256": "5385767a00df18169e12d29f565a0125ffcbaa03f5368140fd7ffb2c9496b781",
      "batch_id": "cfpb-20260722T131356Z-5385767a00df",
      "end_exclusive": "2024-09-01",
      "manifest_relative_path": "data/manifests/cfpb/cfpb-20260722T131356Z-5385767a00df.json",
      "month": "2024-08",
      "ordinal": 11,
      "preflight_count": 75893,
      "returned_record_count": 75893,
      "start_inclusive": "2024-08-01"
    },
    {
      "api_date_received_max": "2024-09-30",
      "api_date_received_min": "2024-09-01",
      "artifact_byte_count": 126968038,
      "artifact_relative_path": "data/raw/cfpb/sha256/88/8874814b08949dd5347699ad0d36e273c9e9460d2c6781e26d92c5593f80c9ac.json",
      "artifact_sha256": "8874814b08949dd5347699ad0d36e273c9e9460d2c6781e26d92c5593f80c9ac",
      "batch_id": "cfpb-20260722T131431Z-8874814b0894",
      "end_exclusive": "2024-10-01",
      "manifest_relative_path": "data/manifests/cfpb/cfpb-20260722T131431Z-8874814b0894.json",
      "month": "2024-09",
      "ordinal": 12,
      "preflight_count": 74366,
      "returned_record_count": 74366,
      "start_inclusive": "2024-09-01"
    },
    {